<?xml version="1.0" encoding="UTF-8"?>
<!DOCTYPE CFXML [
            <!ELEMENT CFXML (thisDocumentGenerationDateTime,thisDocumentIdentifier,CFData)>
            <!ELEMENT thisDocumentGenerationDateTime (DateTimeStamp)>
            <!ELEMENT thisDocumentIdentifier (ProprietaryDocumentIdentifier)>
            <!ELEMENT CFData (ProprietaryInformation*,ProprietaryShippingInformation?,ProductLineItem+,CFReportBLOB?)>
            <!ELEMENT ProprietaryShippingInformation (Name, FinancialAmount)>
            <!ELEMENT ShippingUnitListPrice (FinancialAmount, PriceTerm)>
            <!ELEMENT DateTimeStamp (#PCDATA)>
            <!ELEMENT ProprietaryDocumentIdentifier (#PCDATA)>
            <!ELEMENT ProprietaryInformation (Name,Value)>
            <!ELEMENT ProductLineItem (  ProductLineNumber , TransactionType , CPUSIUvalue , ConfigurationControlNumber?, ProprietaryGroupIdentifier , ServicePacLineNumberReference? , Quantity  , ProductIdentification , UnitListPrice? , ShippingUnitListPrice? , MaintenanceUnitListPrice? , ProductSubLineItem* ) >
            <!ELEMENT CFReportBLOB  (#PCDATA)>
            <!ELEMENT Name  (#PCDATA)>
            <!ELEMENT Value (#PCDATA)>
            <!ELEMENT CPUSIUvalue (#PCDATA)>
            <!ELEMENT ConfigurationControlNumber (#PCDATA)>
            <!ELEMENT ProductLineNumber (#PCDATA)>
            <!ELEMENT ProprietaryGroupIdentifier (#PCDATA)>
            <!ELEMENT ServicePacLineNumberReference (#PCDATA)>
            <!ELEMENT Quantity (#PCDATA)>
            <!ELEMENT TransactionType (#PCDATA)>
            <!ELEMENT ProductIdentification (PartnerProductIdentification*) >
            <!ELEMENT ProductSubLineItem ( LineNumber, TransactionType, Quantity , ExchangeAddSubLineItemNumber? , ProductIdentification, UnitListPrice?,MaintenanceUnitListPrice?)>
            <!ELEMENT UnitListPrice ( FinancialAmount, PriceTerm)>
            <!ELEMENT MaintenanceUnitListPrice (FinancialAmount, PriceTerm)>
            <!ELEMENT PartnerProductIdentification ( OrderedProductIdentifier?, ProprietaryProductIdentifier, ProductDescription?, ProductTypeCode?, ProductIdentifierTypeCode?) >
            <!ELEMENT LineNumber (#PCDATA)>
            <!ELEMENT ExchangeAddSubLineItemNumber (#PCDATA)>
            <!ELEMENT FinancialAmount ( GlobalCurrencyCode, MonetaryAmount )>
            <!ELEMENT PriceTerm (#PCDATA)>
            <!ELEMENT OrderedProductIdentifier (#PCDATA)>
            <!ELEMENT ProprietaryProductIdentifier (#PCDATA)>
            <!ELEMENT ProductDescription (#PCDATA)>
            <!ELEMENT ProductTypeCode (#PCDATA)>
            <!ELEMENT ProductIdentifierTypeCode (#PCDATA)>
            <!ELEMENT GlobalCurrencyCode (#PCDATA)>
            <!ELEMENT MonetaryAmount (#PCDATA)>
            
]>
<CFXML>
  <thisDocumentGenerationDateTime>
    <DateTimeStamp>02:34:54</DateTimeStamp>
  </thisDocumentGenerationDateTime>
  <thisDocumentIdentifier>
    <ProprietaryDocumentIdentifier>CFXML.storage m.2025-05-09T00:00:00+00:00</ProprietaryDocumentIdentifier>
  </thisDocumentIdentifier>
  <CFData>
    <ProprietaryInformation>
      <Name>CFXML</Name>
      <Value>1.0</Value>
    </ProprietaryInformation>
    <ProprietaryInformation>
      <Name>Configurator Identifier</Name>
      <Value>ECMSSD.90501a251073</Value>
    </ProprietaryInformation>
    <ProprietaryInformation>
      <Name>Price File Date</Name>
      <Value>2025-05-09</Value>
    </ProprietaryInformation>
    <ProprietaryInformation>
      <Name>Checksum</Name>
      <Value>3743888622</Value>
    </ProprietaryInformation>
    <ProprietaryShippingInformation>
      <Name>Total Non-discountable Shipping and Handling Charge</Name>
      <FinancialAmount>
        <GlobalCurrencyCode>KWON</GlobalCurrencyCode>
        <MonetaryAmount>3,029.4</MonetaryAmount>
      </FinancialAmount>
    </ProprietaryShippingInformation>
    <ProductLineItem>
      <ProductLineNumber>1000</ProductLineNumber>
      <TransactionType>NEW</TransactionType>
      <CPUSIUvalue>1</CPUSIUvalue>
      <ProprietaryGroupIdentifier>1000</ProprietaryGroupIdentifier>
      <Quantity>1</Quantity>
      <ProductIdentification>
        <PartnerProductIdentification>
          <OrderedProductIdentifier>N/A</OrderedProductIdentifier>
          <ProprietaryProductIdentifier>4657-924</ProprietaryProductIdentifier>
          <ProductDescription>4657-924 #1:IBM FlashSystem 7300 NVMe Control Enclosure</ProductDescription>
          <ProductTypeCode>Hardware</ProductTypeCode>
          <ProductIdentifierTypeCode>MTM-FC</ProductIdentifierTypeCode>
        </PartnerProductIdentification>
      </ProductIdentification>
      <UnitListPrice>
        <FinancialAmount>
          <GlobalCurrencyCode>KWON</GlobalCurrencyCode>
          <MonetaryAmount>322,393.2</MonetaryAmount>
        </FinancialAmount>
        <PriceTerm>0</PriceTerm>
      </UnitListPrice>
      <ShippingUnitListPrice>
        <FinancialAmount>
          <GlobalCurrencyCode>KWON</GlobalCurrencyCode>
          <MonetaryAmount>947.01</MonetaryAmount>
        </FinancialAmount>
        <PriceTerm>0</PriceTerm>
      </ShippingUnitListPrice>
      <ProductSubLineItem>
        <LineNumber>1001</LineNumber>
        <TransactionType>ADD</TransactionType>
        <Quantity>1</Quantity>
        <ProductIdentification>
          <PartnerProductIdentification>
            <OrderedProductIdentifier></OrderedProductIdentifier>
            <ProprietaryProductIdentifier>9730</ProprietaryProductIdentifier>
            <ProductDescription>Power Cord - PDU Connection</ProductDescription>
            <ProductTypeCode>Hardware</ProductTypeCode>
            <ProductIdentifierTypeCode>MTM-FC</ProductIdentifierTypeCode>
          </PartnerProductIdentification>
        </ProductIdentification>
        <UnitListPrice>
          <FinancialAmount>
            <GlobalCurrencyCode>KWON</GlobalCurrencyCode>
            <MonetaryAmount>100.7</MonetaryAmount>
          </FinancialAmount>
          <PriceTerm>0</PriceTerm>
        </UnitListPrice>
      </ProductSubLineItem>
      <ProductSubLineItem>
        <LineNumber>1002</LineNumber>
        <TransactionType>ADD</TransactionType>
        <Quantity>1</Quantity>
        <ProductIdentification>
          <PartnerProductIdentification>
            <OrderedProductIdentifier></OrderedProductIdentifier>
            <ProprietaryProductIdentifier>ACGB</ProprietaryProductIdentifier>
            <ProductDescription>768 GB Cache upgrade</ProductDescription>
            <ProductTypeCode>Hardware</ProductTypeCode>
            <ProductIdentifierTypeCode>MTM-FC</ProductIdentifierTypeCode>
          </PartnerProductIdentification>
        </ProductIdentification>
        <UnitListPrice>
          <FinancialAmount>
            <GlobalCurrencyCode>KWON</GlobalCurrencyCode>
            <MonetaryAmount>60,603.2</MonetaryAmount>
          </FinancialAmount>
          <PriceTerm>0</PriceTerm>
        </UnitListPrice>
      </ProductSubLineItem>
      <ProductSubLineItem>
        <LineNumber>1003</LineNumber>
        <TransactionType>ADD</TransactionType>
        <Quantity>1</Quantity>
        <ProductIdentification>
          <PartnerProductIdentification>
            <OrderedProductIdentifier></OrderedProductIdentifier>
            <ProprietaryProductIdentifier>ACGJ</ProprietaryProductIdentifier>
            <ProductDescription>512 GB Cache upgrade</ProductDescription>
            <ProductTypeCode>Hardware</ProductTypeCode>
            <ProductIdentifierTypeCode>MTM-FC</ProductIdentifierTypeCode>
          </PartnerProductIdentification>
        </ProductIdentification>
        <UnitListPrice>
          <FinancialAmount>
            <GlobalCurrencyCode>KWON</GlobalCurrencyCode>
            <MonetaryAmount>40,425</MonetaryAmount>
          </FinancialAmount>
          <PriceTerm>0</PriceTerm>
        </UnitListPrice>
      </ProductSubLineItem>
      <ProductSubLineItem>
        <LineNumber>1004</LineNumber>
        <TransactionType>ADD</TransactionType>
        <Quantity>2</Quantity>
        <ProductIdentification>
          <PartnerProductIdentification>
            <OrderedProductIdentifier></OrderedProductIdentifier>
            <ProprietaryProductIdentifier>ACGV</ProprietaryProductIdentifier>
            <ProductDescription>240 GB M.2 Boot drive Pair</ProductDescription>
            <ProductTypeCode>Hardware</ProductTypeCode>
            <ProductIdentifierTypeCode>MTM-FC</ProductIdentifierTypeCode>
          </PartnerProductIdentification>
        </ProductIdentification>
        <UnitListPrice>
          <FinancialAmount>
            <GlobalCurrencyCode>KWON</GlobalCurrencyCode>
            <MonetaryAmount>N/C</MonetaryAmount>
          </FinancialAmount>
          <PriceTerm>0</PriceTerm>
        </UnitListPrice>
      </ProductSubLineItem>
      <ProductSubLineItem>
        <LineNumber>1005</LineNumber>
        <TransactionType>ADD</TransactionType>
        <Quantity>16</Quantity>
        <ProductIdentification>
          <PartnerProductIdentification>
            <OrderedProductIdentifier></OrderedProductIdentifier>
            <ProprietaryProductIdentifier>ACSR</ProprietaryProductIdentifier>
            <ProductDescription>5m OM3 Fiber Cable (LC)</ProductDescription>
            <ProductTypeCode>Hardware</ProductTypeCode>
            <ProductIdentifierTypeCode>MTM-FC</ProductIdentifierTypeCode>
          </PartnerProductIdentification>
        </ProductIdentification>
        <UnitListPrice>
          <FinancialAmount>
            <GlobalCurrencyCode>KWON</GlobalCurrencyCode>
            <MonetaryAmount>225.5</MonetaryAmount>
          </FinancialAmount>
          <PriceTerm>0</PriceTerm>
        </UnitListPrice>
      </ProductSubLineItem>
      <ProductSubLineItem>
        <LineNumber>1006</LineNumber>
        <TransactionType>ADD</TransactionType>
        <Quantity>2</Quantity>
        <ProductIdentification>
          <PartnerProductIdentification>
            <OrderedProductIdentifier></OrderedProductIdentifier>
            <ProprietaryProductIdentifier>ADBE</ProprietaryProductIdentifier>
            <ProductDescription>32 Gb FC 4 Port Adapter Cards (Pair)</ProductDescription>
            <ProductTypeCode>Hardware</ProductTypeCode>
            <ProductIdentifierTypeCode>MTM-FC</ProductIdentifierTypeCode>
          </PartnerProductIdentification>
        </ProductIdentification>
        <UnitListPrice>
          <FinancialAmount>
            <GlobalCurrencyCode>KWON</GlobalCurrencyCode>
            <MonetaryAmount>26,002.4</MonetaryAmount>
          </FinancialAmount>
          <PriceTerm>0</PriceTerm>
        </UnitListPrice>
      </ProductSubLineItem>
      <ProductSubLineItem>
        <LineNumber>1007</LineNumber>
        <TransactionType>ADD</TransactionType>
        <Quantity>1</Quantity>
        <ProductIdentification>
          <PartnerProductIdentification>
            <OrderedProductIdentifier></OrderedProductIdentifier>
            <ProprietaryProductIdentifier>ADN1</ProprietaryProductIdentifier>
            <ProductDescription>Order Type 1 Indicator - CTO</ProductDescription>
            <ProductTypeCode>Hardware</ProductTypeCode>
            <ProductIdentifierTypeCode>MTM-FC</ProductIdentifierTypeCode>
          </PartnerProductIdentification>
        </ProductIdentification>
        <UnitListPrice>
          <FinancialAmount>
            <GlobalCurrencyCode>KWON</GlobalCurrencyCode>
            <MonetaryAmount>N/C</MonetaryAmount>
          </FinancialAmount>
          <PriceTerm>0</PriceTerm>
        </UnitListPrice>
      </ProductSubLineItem>
      <ProductSubLineItem>
        <LineNumber>1008</LineNumber>
        <TransactionType>ADD</TransactionType>
        <Quantity>9</Quantity>
        <ProductIdentification>
          <PartnerProductIdentification>
            <OrderedProductIdentifier></OrderedProductIdentifier>
            <ProprietaryProductIdentifier>ADT4</ProprietaryProductIdentifier>
            <ProductDescription>7.68 TB NVMe Flash Drive</ProductDescription>
            <ProductTypeCode>Hardware</ProductTypeCode>
            <ProductIdentifierTypeCode>MTM-FC</ProductIdentifierTypeCode>
          </PartnerProductIdentification>
        </ProductIdentification>
        <UnitListPrice>
          <FinancialAmount>
            <GlobalCurrencyCode>KWON</GlobalCurrencyCode>
            <MonetaryAmount>27,255.7</MonetaryAmount>
          </FinancialAmount>
          <PriceTerm>0</PriceTerm>
        </UnitListPrice>
      </ProductSubLineItem>
      <ProductSubLineItem>
        <LineNumber>1009</LineNumber>
        <TransactionType>ADD</TransactionType>
        <Quantity>1</Quantity>
        <ProductIdentification>
          <PartnerProductIdentification>
            <OrderedProductIdentifier></OrderedProductIdentifier>
            <ProprietaryProductIdentifier>AHZE</ProprietaryProductIdentifier>
            <ProductDescription>Hybrid Flash Indicator</ProductDescription>
            <ProductTypeCode>Hardware</ProductTypeCode>
            <ProductIdentifierTypeCode>MTM-FC</ProductIdentifierTypeCode>
          </PartnerProductIdentification>
        </ProductIdentification>
        <UnitListPrice>
          <FinancialAmount>
            <GlobalCurrencyCode>KWON</GlobalCurrencyCode>
            <MonetaryAmount>N/C</MonetaryAmount>
          </FinancialAmount>
          <PriceTerm>0</PriceTerm>
        </UnitListPrice>
      </ProductSubLineItem>
      <ProductSubLineItem>
        <LineNumber>1010</LineNumber>
        <TransactionType>ADD</TransactionType>
        <Quantity>1</Quantity>
        <ProductIdentification>
          <PartnerProductIdentification>
            <OrderedProductIdentifier></OrderedProductIdentifier>
            <ProprietaryProductIdentifier>AKNC</ProprietaryProductIdentifier>
            <ProductDescription>Premium S&amp;H Indicator</ProductDescription>
            <ProductTypeCode>Hardware</ProductTypeCode>
            <ProductIdentifierTypeCode>MTM-FC</ProductIdentifierTypeCode>
          </PartnerProductIdentification>
        </ProductIdentification>
        <UnitListPrice>
          <FinancialAmount>
            <GlobalCurrencyCode>KWON</GlobalCurrencyCode>
            <MonetaryAmount>0</MonetaryAmount>
          </FinancialAmount>
          <PriceTerm>0</PriceTerm>
        </UnitListPrice>
      </ProductSubLineItem>
      <ProductSubLineItem>
        <LineNumber>1011</LineNumber>
        <TransactionType>ADD</TransactionType>
        <Quantity>1</Quantity>
        <ProductIdentification>
          <PartnerProductIdentification>
            <OrderedProductIdentifier></OrderedProductIdentifier>
            <ProprietaryProductIdentifier>ALH0</ProprietaryProductIdentifier>
            <ProductDescription>Expert Care Indicator</ProductDescription>
            <ProductTypeCode>Hardware</ProductTypeCode>
            <ProductIdentifierTypeCode>MTM-FC</ProductIdentifierTypeCode>
          </PartnerProductIdentification>
        </ProductIdentification>
        <UnitListPrice>
          <FinancialAmount>
            <GlobalCurrencyCode>KWON</GlobalCurrencyCode>
            <MonetaryAmount>N/C</MonetaryAmount>
          </FinancialAmount>
          <PriceTerm>0</PriceTerm>
        </UnitListPrice>
      </ProductSubLineItem>
      <ProductSubLineItem>
        <LineNumber>1012</LineNumber>
        <TransactionType>ADD</TransactionType>
        <Quantity>1</Quantity>
        <ProductIdentification>
          <PartnerProductIdentification>
            <OrderedProductIdentifier></OrderedProductIdentifier>
            <ProprietaryProductIdentifier>ALK3</ProprietaryProductIdentifier>
            <ProductDescription>EC Advanced 3 Year</ProductDescription>
            <ProductTypeCode>Hardware</ProductTypeCode>
            <ProductIdentifierTypeCode>MTM-FC</ProductIdentifierTypeCode>
          </PartnerProductIdentification>
        </ProductIdentification>
        <UnitListPrice>
          <FinancialAmount>
            <GlobalCurrencyCode>KWON</GlobalCurrencyCode>
            <MonetaryAmount>N/C</MonetaryAmount>
          </FinancialAmount>
          <PriceTerm>0</PriceTerm>
        </UnitListPrice>
      </ProductSubLineItem>
    </ProductLineItem>
    <ProductLineItem>
      <ProductLineNumber>2000</ProductLineNumber>
      <TransactionType>NEW</TransactionType>
      <CPUSIUvalue>0</CPUSIUvalue>
      <ProprietaryGroupIdentifier>1000</ProprietaryGroupIdentifier>
      <Quantity>1</Quantity>
      <ProductIdentification>
        <PartnerProductIdentification>
          <OrderedProductIdentifier>N/A</OrderedProductIdentifier>
          <ProprietaryProductIdentifier>4658-A03</ProprietaryProductIdentifier>
          <ProductDescription>4657-924 #1:3 year IBM Storage Expert Care Advanced</ProductDescription>
          <ProductTypeCode>Hardware</ProductTypeCode>
          <ProductIdentifierTypeCode>MTM-FC</ProductIdentifierTypeCode>
        </PartnerProductIdentification>
      </ProductIdentification>
      <UnitListPrice>
        <FinancialAmount>
          <GlobalCurrencyCode>KWON</GlobalCurrencyCode>
          <MonetaryAmount>119,531.97</MonetaryAmount>
        </FinancialAmount>
        <PriceTerm>0</PriceTerm>
      </UnitListPrice>
    </ProductLineItem>
    <ProductLineItem>
      <ProductLineNumber>3000</ProductLineNumber>
      <TransactionType>NEW</TransactionType>
      <CPUSIUvalue>0</CPUSIUvalue>
      <ProprietaryGroupIdentifier>1000</ProprietaryGroupIdentifier>
      <Quantity>1</Quantity>
      <ProductIdentification>
        <PartnerProductIdentification>
          <OrderedProductIdentifier>N/A</OrderedProductIdentifier>
          <ProprietaryProductIdentifier>5773-STG</ProprietaryProductIdentifier>
          <ProductDescription>Support Line for Storage - 3 Year</ProductDescription>
          <ProductTypeCode>Software</ProductTypeCode>
          <ProductIdentifierTypeCode>MTM-FC</ProductIdentifierTypeCode>
        </PartnerProductIdentification>
      </ProductIdentification>
      <UnitListPrice>
        <FinancialAmount>
          <GlobalCurrencyCode>KWON</GlobalCurrencyCode>
          <MonetaryAmount>N/C</MonetaryAmount>
        </FinancialAmount>
        <PriceTerm>0</PriceTerm>
      </UnitListPrice>
      <ProductSubLineItem>
        <LineNumber>3001</LineNumber>
        <TransactionType>ADD</TransactionType>
        <Quantity>1</Quantity>
        <ProductIdentification>
          <PartnerProductIdentification>
            <OrderedProductIdentifier></OrderedProductIdentifier>
            <ProprietaryProductIdentifier>2000</ProprietaryProductIdentifier>
            <ProductDescription>Support per Server (N/C)</ProductDescription>
            <ProductTypeCode>Software</ProductTypeCode>
            <ProductIdentifierTypeCode>MTM-FC</ProductIdentifierTypeCode>
          </PartnerProductIdentification>
        </ProductIdentification>
        <UnitListPrice>
          <FinancialAmount>
            <GlobalCurrencyCode>KWON</GlobalCurrencyCode>
            <MonetaryAmount>N/C</MonetaryAmount>
          </FinancialAmount>
          <PriceTerm>0</PriceTerm>
        </UnitListPrice>
      </ProductSubLineItem>
    </ProductLineItem>
    <ProductLineItem>
      <ProductLineNumber>4000</ProductLineNumber>
      <TransactionType>NEW</TransactionType>
      <CPUSIUvalue>1</CPUSIUvalue>
      <ProprietaryGroupIdentifier>4000</ProprietaryGroupIdentifier>
      <Quantity>1</Quantity>
      <ProductIdentification>
        <PartnerProductIdentification>
          <OrderedProductIdentifier>N/A</OrderedProductIdentifier>
          <ProprietaryProductIdentifier>4662-7H2</ProprietaryProductIdentifier>
          <ProductDescription>4662-7H2 #3:IBM Storage FlashSystem 5300 NVMe Control Enclosure</ProductDescription>
          <ProductTypeCode>Hardware</ProductTypeCode>
          <ProductIdentifierTypeCode>MTM-FC</ProductIdentifierTypeCode>
        </PartnerProductIdentification>
      </ProductIdentification>
      <UnitListPrice>
        <FinancialAmount>
          <GlobalCurrencyCode>KWON</GlobalCurrencyCode>
          <MonetaryAmount>79,713.2</MonetaryAmount>
        </FinancialAmount>
        <PriceTerm>0</PriceTerm>
      </UnitListPrice>
      <ShippingUnitListPrice>
        <FinancialAmount>
          <GlobalCurrencyCode>KWON</GlobalCurrencyCode>
          <MonetaryAmount>520.71</MonetaryAmount>
        </FinancialAmount>
        <PriceTerm>0</PriceTerm>
      </ShippingUnitListPrice>
      <ProductSubLineItem>
        <LineNumber>4001</LineNumber>
        <TransactionType>ADD</TransactionType>
        <Quantity>1</Quantity>
        <ProductIdentification>
          <PartnerProductIdentification>
            <OrderedProductIdentifier></OrderedProductIdentifier>
            <ProprietaryProductIdentifier>9730</ProprietaryProductIdentifier>
            <ProductDescription>Power Cord - PDU Connection</ProductDescription>
            <ProductTypeCode>Hardware</ProductTypeCode>
            <ProductIdentifierTypeCode>MTM-FC</ProductIdentifierTypeCode>
          </PartnerProductIdentification>
        </ProductIdentification>
        <UnitListPrice>
          <FinancialAmount>
            <GlobalCurrencyCode>KWON</GlobalCurrencyCode>
            <MonetaryAmount>97.6</MonetaryAmount>
          </FinancialAmount>
          <PriceTerm>0</PriceTerm>
        </UnitListPrice>
      </ProductSubLineItem>
      <ProductSubLineItem>
        <LineNumber>4002</LineNumber>
        <TransactionType>ADD</TransactionType>
        <Quantity>1</Quantity>
        <ProductIdentification>
          <PartnerProductIdentification>
            <OrderedProductIdentifier></OrderedProductIdentifier>
            <ProprietaryProductIdentifier>ADN1</ProprietaryProductIdentifier>
            <ProductDescription>Order Type 1 Indicator - CTO</ProductDescription>
            <ProductTypeCode>Hardware</ProductTypeCode>
            <ProductIdentifierTypeCode>MTM-FC</ProductIdentifierTypeCode>
          </PartnerProductIdentification>
        </ProductIdentification>
        <UnitListPrice>
          <FinancialAmount>
            <GlobalCurrencyCode>KWON</GlobalCurrencyCode>
            <MonetaryAmount>N/C</MonetaryAmount>
          </FinancialAmount>
          <PriceTerm>0</PriceTerm>
        </UnitListPrice>
      </ProductSubLineItem>
      <ProductSubLineItem>
        <LineNumber>4003</LineNumber>
        <TransactionType>ADD</TransactionType>
        <Quantity>1</Quantity>
        <ProductIdentification>
          <PartnerProductIdentification>
            <OrderedProductIdentifier></OrderedProductIdentifier>
            <ProprietaryProductIdentifier>AHPG</ProprietaryProductIdentifier>
            <ProductDescription>AC Power Supply (100-240v) (Pair)</ProductDescription>
            <ProductTypeCode>Hardware</ProductTypeCode>
            <ProductIdentifierTypeCode>MTM-FC</ProductIdentifierTypeCode>
          </PartnerProductIdentification>
        </ProductIdentification>
        <UnitListPrice>
          <FinancialAmount>
            <GlobalCurrencyCode>KWON</GlobalCurrencyCode>
            <MonetaryAmount>0</MonetaryAmount>
          </FinancialAmount>
          <PriceTerm>0</PriceTerm>
        </UnitListPrice>
      </ProductSubLineItem>
      <ProductSubLineItem>
        <LineNumber>4004</LineNumber>
        <TransactionType>ADD</TransactionType>
        <Quantity>1</Quantity>
        <ProductIdentification>
          <PartnerProductIdentification>
            <OrderedProductIdentifier></OrderedProductIdentifier>
            <ProprietaryProductIdentifier>AHZD</ProprietaryProductIdentifier>
            <ProductDescription>All Flash Solution Indicator</ProductDescription>
            <ProductTypeCode>Hardware</ProductTypeCode>
            <ProductIdentifierTypeCode>MTM-FC</ProductIdentifierTypeCode>
          </PartnerProductIdentification>
        </ProductIdentification>
        <UnitListPrice>
          <FinancialAmount>
            <GlobalCurrencyCode>KWON</GlobalCurrencyCode>
            <MonetaryAmount>N/C</MonetaryAmount>
          </FinancialAmount>
          <PriceTerm>0</PriceTerm>
        </UnitListPrice>
      </ProductSubLineItem>
      <ProductSubLineItem>
        <LineNumber>4005</LineNumber>
        <TransactionType>ADD</TransactionType>
        <Quantity>1</Quantity>
        <ProductIdentification>
          <PartnerProductIdentification>
            <OrderedProductIdentifier></OrderedProductIdentifier>
            <ProprietaryProductIdentifier>AKCH</ProprietaryProductIdentifier>
            <ProductDescription>Standard S&amp;H Indicator</ProductDescription>
            <ProductTypeCode>Hardware</ProductTypeCode>
            <ProductIdentifierTypeCode>MTM-FC</ProductIdentifierTypeCode>
          </PartnerProductIdentification>
        </ProductIdentification>
        <UnitListPrice>
          <FinancialAmount>
            <GlobalCurrencyCode>KWON</GlobalCurrencyCode>
            <MonetaryAmount>0</MonetaryAmount>
          </FinancialAmount>
          <PriceTerm>0</PriceTerm>
        </UnitListPrice>
      </ProductSubLineItem>
      <ProductSubLineItem>
        <LineNumber>4006</LineNumber>
        <TransactionType>ADD</TransactionType>
        <Quantity>1</Quantity>
        <ProductIdentification>
          <PartnerProductIdentification>
            <OrderedProductIdentifier></OrderedProductIdentifier>
            <ProprietaryProductIdentifier>ALB2</ProprietaryProductIdentifier>
            <ProductDescription>32 Gb FC 4 Port Adapter Cards (Pair)</ProductDescription>
            <ProductTypeCode>Hardware</ProductTypeCode>
            <ProductIdentifierTypeCode>MTM-FC</ProductIdentifierTypeCode>
          </PartnerProductIdentification>
        </ProductIdentification>
        <UnitListPrice>
          <FinancialAmount>
            <GlobalCurrencyCode>KWON</GlobalCurrencyCode>
            <MonetaryAmount>31,760.8</MonetaryAmount>
          </FinancialAmount>
          <PriceTerm>0</PriceTerm>
        </UnitListPrice>
      </ProductSubLineItem>
      <ProductSubLineItem>
        <LineNumber>4007</LineNumber>
        <TransactionType>ADD</TransactionType>
        <Quantity>1</Quantity>
        <ProductIdentification>
          <PartnerProductIdentification>
            <OrderedProductIdentifier></OrderedProductIdentifier>
            <ProprietaryProductIdentifier>ALE0</ProprietaryProductIdentifier>
            <ProductDescription>Encryption Enablement</ProductDescription>
            <ProductTypeCode>Hardware</ProductTypeCode>
            <ProductIdentifierTypeCode>MTM-FC</ProductIdentifierTypeCode>
          </PartnerProductIdentification>
        </ProductIdentification>
        <UnitListPrice>
          <FinancialAmount>
            <GlobalCurrencyCode>KWON</GlobalCurrencyCode>
            <MonetaryAmount>8,667.6</MonetaryAmount>
          </FinancialAmount>
          <PriceTerm>0</PriceTerm>
        </UnitListPrice>
      </ProductSubLineItem>
      <ProductSubLineItem>
        <LineNumber>4008</LineNumber>
        <TransactionType>ADD</TransactionType>
        <Quantity>1</Quantity>
        <ProductIdentification>
          <PartnerProductIdentification>
            <OrderedProductIdentifier></OrderedProductIdentifier>
            <ProprietaryProductIdentifier>ALEC</ProprietaryProductIdentifier>
            <ProductDescription>Encryption USB Flash Drives (Four Pack)</ProductDescription>
            <ProductTypeCode>Hardware</ProductTypeCode>
            <ProductIdentifierTypeCode>MTM-FC</ProductIdentifierTypeCode>
          </PartnerProductIdentification>
        </ProductIdentification>
        <UnitListPrice>
          <FinancialAmount>
            <GlobalCurrencyCode>KWON</GlobalCurrencyCode>
            <MonetaryAmount>693.5</MonetaryAmount>
          </FinancialAmount>
          <PriceTerm>0</PriceTerm>
        </UnitListPrice>
      </ProductSubLineItem>
      <ProductSubLineItem>
        <LineNumber>4009</LineNumber>
        <TransactionType>ADD</TransactionType>
        <Quantity>1</Quantity>
        <ProductIdentification>
          <PartnerProductIdentification>
            <OrderedProductIdentifier></OrderedProductIdentifier>
            <ProprietaryProductIdentifier>ALG3</ProprietaryProductIdentifier>
            <ProductDescription>256 GB Base Cache (FS5300)</ProductDescription>
            <ProductTypeCode>Hardware</ProductTypeCode>
            <ProductIdentifierTypeCode>MTM-FC</ProductIdentifierTypeCode>
          </PartnerProductIdentification>
        </ProductIdentification>
        <UnitListPrice>
          <FinancialAmount>
            <GlobalCurrencyCode>KWON</GlobalCurrencyCode>
            <MonetaryAmount>22,613.7</MonetaryAmount>
          </FinancialAmount>
          <PriceTerm>0</PriceTerm>
        </UnitListPrice>
      </ProductSubLineItem>
      <ProductSubLineItem>
        <LineNumber>4010</LineNumber>
        <TransactionType>ADD</TransactionType>
        <Quantity>1</Quantity>
        <ProductIdentification>
          <PartnerProductIdentification>
            <OrderedProductIdentifier></OrderedProductIdentifier>
            <ProprietaryProductIdentifier>ALH0</ProprietaryProductIdentifier>
            <ProductDescription>IBM Storage Expert Care Indicator</ProductDescription>
            <ProductTypeCode>Hardware</ProductTypeCode>
            <ProductIdentifierTypeCode>MTM-FC</ProductIdentifierTypeCode>
          </PartnerProductIdentification>
        </ProductIdentification>
        <UnitListPrice>
          <FinancialAmount>
            <GlobalCurrencyCode>KWON</GlobalCurrencyCode>
            <MonetaryAmount>N/C</MonetaryAmount>
          </FinancialAmount>
          <PriceTerm>0</PriceTerm>
        </UnitListPrice>
      </ProductSubLineItem>
      <ProductSubLineItem>
        <LineNumber>4011</LineNumber>
        <TransactionType>ADD</TransactionType>
        <Quantity>1</Quantity>
        <ProductIdentification>
          <PartnerProductIdentification>
            <OrderedProductIdentifier></OrderedProductIdentifier>